{
  "schema": "lamina.runtime-qualification-result/v1",
  "generated_at": "2026-08-04T05:18:58.416Z",
  "index": {
    "schema": "lamina.runtime-qualification-index/v1",
    "generated_at": "2026-08-04T05:18:58.416Z",
    "lamina_commit": "4c82f37909141067c1f4677feee53c81fe59bbb5",
    "manifest_digest": "1f62d68e8fad47c48fb10a5ca20a124b8b96cf2932d8f58214e35f1249c4fb71",
    "baseline_manifest_digest": "f09b150e794c6839611e47b54e2deb769462cfb6411548231017774944f5e975",
    "host": {
      "platform": "linux",
      "arch": "x64",
      "release": "7.0.0-28-generic",
      "memory_bytes": 65562333184
    },
    "profile": "16gb",
    "mode": "full",
    "cells": [
      {
        "profile": "16gb",
        "fixture": "small",
        "platform": "linux-x64",
        "baseline_output": "/tmp/lamina-qual-pids-events",
        "index": {
          "schema": "lamina.runtime-baseline-index/v1",
          "generated_at": "2026-08-04T05:11:18.580Z",
          "manifest_digest": "f09b150e794c6839611e47b54e2deb769462cfb6411548231017774944f5e975",
          "host": {
            "platform": "linux",
            "release": "7.0.0-28-generic",
            "architecture": "x64",
            "cpu": "Intel(R) Core(TM) Ultra 9 185H",
            "memory_bytes": 65562333184
          },
          "fixture": "small",
          "completed": [
            "small-footprint.json",
            "small-doctor-status-startup.json",
            "small-initial-observation.json",
            "small-initial-retrieval-readiness.json",
            "small-first-useful-preparation.json"
          ],
          "scenarios": [
            {
              "scenario": "footprint",
              "status": "valid"
            },
            {
              "scenario": "doctor-status-startup",
              "status": "valid"
            },
            {
              "scenario": "initial-observation",
              "status": "valid"
            },
            {
              "scenario": "initial-retrieval-readiness",
              "status": "valid"
            },
            {
              "scenario": "first-useful-preparation",
              "status": "invalid"
            },
            {
              "scenario": "warm-preparation",
              "status": "blocked_after_previous_failure"
            },
            {
              "scenario": "noop-synchronization",
              "status": "blocked_after_previous_failure"
            },
            {
              "scenario": "one-file-change",
              "status": "blocked_after_previous_failure"
            },
            {
              "scenario": "multi-file-change",
              "status": "blocked_after_previous_failure"
            },
            {
              "scenario": "full-derived-state-rebuild",
              "status": "blocked_after_previous_failure"
            },
            {
              "scenario": "post-command-idle-rss",
              "status": "blocked_after_previous_failure"
            },
            {
              "scenario": "cancellation-shutdown-cleanup",
              "status": "blocked_after_previous_failure"
            }
          ],
          "expected": 12,
          "complete": false
        },
        "scenario_results": [
          {
            "schema": "lamina.runtime-baseline-result/v1",
            "generated_at": "2026-08-04T04:50:25.415Z",
            "status": "valid",
            "fixture": {
              "id": "small",
              "commit": "9506629ed003a561c6627735480cce4994244bb4",
              "url": "https://github.com/alan2207/bulletproof-react.git"
            },
            "scenario": "footprint",
            "measured_tier": "small",
            "workload": {
              "schema": "lamina.runtime-baseline-workload/v1",
              "manifest_digest": "f09b150e794c6839611e47b54e2deb769462cfb6411548231017774944f5e975",
              "fixture": {
                "id": "small",
                "name": "Bulletproof React",
                "url": "https://github.com/alan2207/bulletproof-react.git",
                "commit": "9506629ed003a561c6627735480cce4994244bb4",
                "class": "small",
                "languages": [
                  "TypeScript",
                  "React"
                ],
                "polyglot": false
              },
              "scenario": "footprint",
              "runtime": {
                "node": "v24.18.0",
                "lamina_commit": "4c82f37909141067c1f4677feee53c81fe59bbb5",
                "assets_release": "cli-v0.3.5"
              },
              "samples": [],
              "statistics": null,
              "classification": "static",
              "repository": {
                "tracked_files": 535,
                "tracked_bytes": 2640087,
                "tracked_source_files": 438,
                "tracked_source_bytes": 628504,
                "tracked_source_loc": 20450,
                "observation_indexed_files": 535,
                "observation_indexed_bytes": 2640087,
                "observation_paths_digest": "a751c5ae498aad42ec231daf714f8bede3e76f1d6f083ccbe3b6097f666b07cc",
                "retrieval_candidate_files": 467,
                "retrieval_candidate_bytes": 693785,
                "retrieval_paths_digest": "8915cb111c9232dd2645d5b470e95fcfddc8a2293f4cc6881a9727c52864d52b",
                "commit": "9506629ed003a561c6627735480cce4994244bb4",
                "exclusion_rules": [
                  ".git",
                  ".agents/skills",
                  ".claude/skills",
                  ".codex/skills",
                  ".opencode/skills",
                  ".lamina/runs",
                  ".lamina/runtime",
                  ".lamina/runtime-cli",
                  "node_modules",
                  "__pycache__",
                  ".venv*",
                  ".next",
                  "dist",
                  "build",
                  "coverage",
                  "benchmarks/results",
                  "evals/fixtures/.vendor-tmp*"
                ],
                "retrieval_indexed_files": null,
                "retrieval_indexed_bytes": null,
                "retrieval_source_chunks": null
              },
              "diagnostics": {
                "source_cli": {
                  "files": 43,
                  "bytes": 77595096
                },
                "prepared_assets": {
                  "files": 4,
                  "bytes": 5950249
                },
                "sealed_model": {
                  "files": 1,
                  "bytes": 161895621
                },
                "sealed_worker": {
                  "files": 1,
                  "bytes": 77038920
                }
              },
              "attribution": {
                "phase_order": [
                  "doctor",
                  "status",
                  "startup",
                  "observation",
                  "retrieval_readiness",
                  "preparation",
                  "noop_sync",
                  "incremental_change",
                  "rebuild",
                  "idle",
                  "shutdown",
                  "cleanup"
                ],
                "phase_ids": [],
                "phase_time_ns": [
                  null,
                  null,
                  null,
                  null,
                  null,
                  null,
                  null,
                  null,
                  null,
                  null,
                  null,
                  null
                ],
                "subprocess_launches": {
                  "graphd": 0,
                  "cocoindex_worker": 0,
                  "onnx_embedder": 0,
                  "cli": 0,
                  "other": 0
                },
                "descendant_peaks_by_phase": {}
              },
              "cleanup": {
                "repository_removed": true,
                "socket_removed": true,
                "lock_removed": true,
                "lifecycle": {
                  "graphd": {
                    "released": false,
                    "reason": "absent"
                  },
                  "orphans": {
                    "stopped": []
                  },
                  "orphan_drain": {
                    "remaining": 0
                  },
                  "orphan_check": {
                    "ok": true,
                    "remaining": []
                  }
                }
              }
            },
            "runs": [
              {
                "tier": "small",
                "purpose": "promotion-and-measurement",
                "sample_index": 0,
                "outcome": "success",
                "limit": null,
                "duration_ms": 5746,
                "peak_memory_bytes": 181608448,
                "peak_pids": 16,
                "peak_temporary_bytes": 15843328,
                "remaining_descendants": 0,
                "remaining_managed_paths": 0,
                "raw_report": "raw/small-footprint-promotion-small.json",
                "raw_report_sha256": "2a77b9d624365d0c12f8708e87d1dcbaf87a7e73101309b9877228d6f1cd1cbc"
              }
            ],
            "limitations": [
              "Linux x64 baseline; other platforms are not represented.",
              "CocoIndex worker and production retrieval model are checksum-pinned release assets; current JavaScript CLI and graphd come from the measured Lamina commit."
            ]
          },
          {
            "schema": "lamina.runtime-baseline-result/v1",
            "generated_at": "2026-08-04T04:50:47.640Z",
            "status": "valid",
            "fixture": {
              "id": "small",
              "commit": "9506629ed003a561c6627735480cce4994244bb4",
              "url": "https://github.com/alan2207/bulletproof-react.git"
            },
            "scenario": "doctor-status-startup",
            "measured_tier": "small",
            "workload": {